{
  "schema": "cia-incident-event/v1",
  "id": "2026-08-12-auto-vault-a-0210",
  "seq": 1,
  "type": "opened",
  "at": "2026-08-12T02:20:00Z",
  "source": "auditor",
  "categories": [
    "A"
  ],
  "services": [
    "vault"
  ],
  "severity": "high",
  "startedAt": "2026-08-12T02:10:00Z",
  "resolvedAt": null,
  "reasons": [
    "timeout"
  ],
  "run": "data/v1/cia/runs/2026/08/12/0220Z.json"
}
