{
  "schema": "cia-incident-event/v1",
  "id": "2026-08-27-auto-sign-i-1410",
  "seq": 1,
  "type": "opened",
  "at": "2026-08-27T14:10:00Z",
  "source": "auditor",
  "categories": [
    "I"
  ],
  "services": [
    "sign"
  ],
  "severity": "critical",
  "startedAt": "2026-08-27T14:10:00Z",
  "resolvedAt": null,
  "reasons": [
    "served-mismatch"
  ],
  "run": "data/v1/cia/runs/2026/08/27/1410Z.json"
}
